{
  "surface_type": "playbook_activation_surface",
  "playbook_id": "AOA-P-0020",
  "name": "incident-recovery-routing",
  "scenario": "incident_recovery_routing",
  "trigger": "incident_requiring_cross_boundary_stabilization_and_handoff",
  "participating_agents": [
    "architect",
    "coder",
    "reviewer",
    "evaluator",
    "memory-keeper"
  ],
  "required_skill_families": [
    "source-of-truth",
    "change-protocol",
    "safe-infra",
    "verification",
    "memory-curation"
  ],
  "expected_artifacts": [
    "incident_map",
    "stabilization_plan",
    "stabilization_change_set",
    "recovery_decision",
    "recovery_verification_pack",
    "handoff_record"
  ],
  "evaluation_posture": "strict",
  "memory_posture": "bounded_recall",
  "fallback_mode": "review_required",
  "eval_anchors": [
    "aoa-approval-boundary-adherence",
    "aoa-scope-drift-detection",
    "aoa-verification-honesty"
  ],
  "return_posture": "artifact_anchor",
  "return_anchor_artifacts": [
    "incident_map",
    "stabilization_plan",
    "recovery_decision",
    "recovery_verification_pack"
  ],
  "return_reentry_modes": [
    "previous_phase",
    "review_gate",
    "rollback_gate",
    "safe_stop"
  ],
  "memo_recall_modes": [
    "working",
    "episodic"
  ],
  "memo_scope_default": "workspace",
  "memo_scope_ceiling": "workspace",
  "memo_read_path": "inspect_then_expand",
  "memo_checkpoint_posture": "preferred",
  "memo_source_route_policy": "preferred"
}
