{
  "surface_type": "playbook_activation_surface",
  "playbook_id": "AOA-P-0046",
  "name": "checkpoint-distillation-closed-loop-pilot",
  "scenario": "checkpoint_distillation_closed_loop_pilot",
  "trigger": "reviewed_checkpoint_needing_distillation_into_a_closed_loop_pilot_runbook",
  "participating_agents": [
    "architect",
    "coder",
    "reviewer",
    "evaluator",
    "memory-keeper"
  ],
  "required_skill_families": [
    "source-of-truth",
    "change-protocol",
    "review",
    "evaluation",
    "memory-curation"
  ],
  "expected_artifacts": [
    "checkpoint_distillation_brief",
    "closed_loop_pilot_runbook",
    "pilot_guardrail_notes",
    "residual_handoff_record"
  ],
  "evaluation_posture": "strict",
  "memory_posture": "bounded_recall",
  "fallback_mode": "safe_stop",
  "eval_anchors": [
    "aoa-bounded-change-quality",
    "aoa-verification-honesty"
  ],
  "return_posture": "artifact_anchor",
  "return_anchor_artifacts": [
    "checkpoint_distillation_brief",
    "closed_loop_pilot_runbook",
    "pilot_guardrail_notes"
  ],
  "return_reentry_modes": [
    "review_gate",
    "safe_stop"
  ],
  "memo_recall_modes": [
    "episodic",
    "semantic"
  ],
  "memo_scope_default": "workspace",
  "memo_scope_ceiling": "workspace",
  "memo_read_path": "inspect_then_expand",
  "memo_checkpoint_posture": "not_needed",
  "memo_source_route_policy": "required"
}
