{
  "surface_type": "playbook_activation_surface",
  "playbook_id": "AOA-P-0018",
  "name": "validation-driven-remediation",
  "scenario": "validation_driven_remediation",
  "trigger": "validation_or_eval_failure_crossing_source_of_truth_boundaries",
  "participating_agents": [
    "architect",
    "coder",
    "reviewer",
    "evaluator",
    "memory-keeper"
  ],
  "required_skill_families": [
    "source-of-truth",
    "change-protocol",
    "verification",
    "evaluation",
    "memory-curation"
  ],
  "expected_artifacts": [
    "failure_map",
    "boundary_map",
    "remediation_change_set",
    "revalidation_pack",
    "remediation_decision",
    "handoff_record"
  ],
  "evaluation_posture": "strict",
  "memory_posture": "bounded_recall",
  "fallback_mode": "review_required",
  "eval_anchors": [
    "aoa-approval-boundary-adherence",
    "aoa-scope-drift-detection",
    "aoa-verification-honesty"
  ],
  "return_posture": "artifact_anchor",
  "return_anchor_artifacts": [
    "failure_map",
    "remediation_decision",
    "revalidation_pack"
  ],
  "return_reentry_modes": [
    "previous_phase",
    "review_gate",
    "rollback_gate",
    "safe_stop"
  ]
}
