{
  "surface_type": "playbook_activation_surface",
  "playbook_id": "AOA-P-0017",
  "name": "split-wave-cross-repo-rollout",
  "scenario": "split_wave_cross_repo_rollout",
  "trigger": "cross_repo_change_requiring_ordered_merge_and_downstream_revalidation",
  "participating_agents": [
    "architect",
    "coder",
    "reviewer",
    "evaluator",
    "memory-keeper"
  ],
  "required_skill_families": [
    "source-of-truth",
    "change-protocol",
    "review",
    "evaluation",
    "memory-curation"
  ],
  "expected_artifacts": [
    "boundary_map",
    "wave_plan",
    "bridge_surface_pack",
    "wave_decision",
    "downstream_revalidation_pack",
    "handoff_record"
  ],
  "evaluation_posture": "strict",
  "memory_posture": "bounded_recall",
  "fallback_mode": "review_required",
  "eval_anchors": [
    "aoa-approval-boundary-adherence",
    "aoa-scope-drift-detection",
    "aoa-verification-honesty"
  ],
  "return_posture": "artifact_anchor",
  "return_anchor_artifacts": [
    "wave_plan",
    "wave_decision",
    "downstream_revalidation_pack"
  ],
  "return_reentry_modes": [
    "previous_phase",
    "review_gate",
    "rollback_gate",
    "safe_stop"
  ]
}
