{
  "surface_type": "playbook_activation_surface",
  "playbook_id": "AOA-P-0019",
  "name": "release-migration-cutover",
  "scenario": "release_migration_cutover",
  "trigger": "release_or_migration_window_requiring_authority_switch",
  "participating_agents": [
    "architect",
    "coder",
    "reviewer",
    "evaluator",
    "memory-keeper"
  ],
  "required_skill_families": [
    "source-of-truth",
    "change-protocol",
    "verification",
    "review",
    "memory-curation"
  ],
  "expected_artifacts": [
    "authority_map",
    "cutover_plan",
    "cutover_decision",
    "cutover_change_set",
    "post_cutover_verification_pack",
    "handoff_record"
  ],
  "evaluation_posture": "strict",
  "memory_posture": "bounded_recall",
  "fallback_mode": "review_required",
  "eval_anchors": [
    "aoa-approval-boundary-adherence",
    "aoa-scope-drift-detection",
    "aoa-verification-honesty"
  ],
  "return_posture": "artifact_anchor",
  "return_anchor_artifacts": [
    "cutover_plan",
    "cutover_decision",
    "post_cutover_verification_pack"
  ],
  "return_reentry_modes": [
    "previous_phase",
    "review_gate",
    "rollback_gate",
    "safe_stop"
  ],
  "memo_recall_modes": [
    "working",
    "episodic"
  ],
  "memo_scope_default": "workspace",
  "memo_scope_ceiling": "workspace",
  "memo_read_path": "inspect_then_expand",
  "memo_checkpoint_posture": "preferred",
  "memo_source_route_policy": "preferred"
}
