{
  "surface_type": "playbook_activation_surface",
  "playbook_id": "AOA-P-0010",
  "name": "cross-repo-boundary-rollout",
  "scenario": "cross_repo_boundary_rollout",
  "trigger": "multi_repo_source_of_truth_change",
  "participating_agents": [
    "architect",
    "coder",
    "reviewer",
    "evaluator",
    "memory-keeper"
  ],
  "required_skill_families": [
    "source-of-truth",
    "change-protocol",
    "review",
    "evaluation",
    "memory-curation"
  ],
  "expected_artifacts": [
    "boundary_map",
    "repo_change_set",
    "rollout_decision",
    "validation_pack",
    "handoff_record"
  ],
  "evaluation_posture": "strict",
  "memory_posture": "bounded_recall",
  "fallback_mode": "review_required",
  "eval_anchors": [
    "aoa-approval-boundary-adherence",
    "aoa-scope-drift-detection"
  ],
  "return_posture": "artifact_anchor",
  "return_anchor_artifacts": [
    "boundary_map",
    "rollout_decision",
    "validation_pack"
  ],
  "return_reentry_modes": [
    "previous_phase",
    "review_gate",
    "safe_stop"
  ],
  "memo_recall_modes": [
    "episodic",
    "semantic"
  ],
  "memo_scope_default": "workspace",
  "memo_scope_ceiling": "workspace",
  "memo_read_path": "inspect_capsule_then_expand",
  "memo_checkpoint_posture": "not_needed",
  "memo_source_route_policy": "required"
}
